{
	"$schema": "schemas/manifest-lock.schema.json",
	"components": {
		"ARCHITECTURE.md": "d76626492126b02b5562ec8a88bc9fcc5401932c252ede64415c98a1805fa392",
		"CHANGELOG.md": "ca4fac7f180773358d679ae09fd058b293c6dd1d7063280d63b78316cd6d515b",
		"README.md": "d6a29fbc3367f5ab5739f84bad71710879119d1b697b6a18943dcdad5e2ec654",
		"VERSION": "8f5c2029067175ceac1b444a2e6d39702d0971ef161e9427478e32435a968a47",
		"agent/backend-specialist.md": "65087ad56011ce55231f2754c3bdbb1c32ee14fa24ae9f389c0a7a67c178f1fd",
		"agent/code-archaeologist.md": "a0c654b885773c425f6a1c3f35ac7a1d509ed32e08a4e2daf373ddc5c6c805f3",
		"agent/database-architect.md": "1649c5ba554eca2674df75c50229cc00463aed1400d3b6d55131d8f4b12f3c76",
		"agent/debugger.md": "5b73decefc6834500ed5f27390021d2ea11e1397c40dd101d6a664217fbbaeac",
		"agent/devops-engineer.md": "5be0ea4c3735f07fa7aa0f6a01cc687491f203d62474620b8921c3164b90d66f",
		"agent/documentation-writer.md": "81a9c80c4a2efbcf15422de72fa289d9a9889c8262af6e3ae69eb2a582826a72",
		"agent/explorer-agent.md": "e326feb00e9b609f167aa40ddf62561ded0b0e03fee385da760492c79ccb71d4",
		"agent/frontend-specialist.md": "a381e047cec9f9bea3f96075e5b10ca087428d8dee2f6f42e94119968f476115",
		"agent/game-developer.md": "dcf76d9bc8d220bb801094eed091255118b7aff9203a8a7b98e10128030dcfd8",
		"agent/mobile-developer.md": "cf9d2ebc6015dc3e2aab092711b111a22cb822e36b3f12d4e351818ecfab6677",
		"agent/orchestrator.md": "ad8bc39b0ea88df822df4597a0eec90424eb1cbd4418213c29a6f33ced3e5269",
		"agent/penetration-tester.md": "842b8684209208fd03dbf181f8fe7b5e84933732fe3d4f1bd8bf18af338b67cb",
		"agent/performance-optimizer.md": "932e6ac2b3f1ecbdf230f9b2ea326208f1f829217ca5066cb46c6bfe5e44c873",
		"agent/product-manager.md": "2ecae9a7a24f2001ca4f60a96731fede4987b43d6e15603fda1e24481fa86c79",
		"agent/product-owner.md": "229c881c9f6df95ce3d4f5b58e3abd4e1e5d3da600e8bbf9aad506bb1cdba34d",
		"agent/project-planner.md": "c64493da3b016eec1978f06c3b81d4e1440df950a3c056e918ccd855335e18b0",
		"agent/qa-automation-engineer.md": "e2ab31b6b355c786bd5a1670ba61afe5cf0adde38dcc093c11a8e3a5da54633a",
		"agent/security-auditor.md": "a526994748a427bf906459664ecdd0131aeb29b8f3dae8a09969af2f75c8a752",
		"agent/seo-specialist.md": "13bba95dd76154f16f9ecbf52d20f8e9cb946085e209dc1339f1f68dcea4c2f0",
		"agent/test-engineer.md": "3e12917431abd98809198d0d167b75ae7f4e5c4c27862a010227dda8d71724d7",
		"antigravity.json": "e69e16886e216762892adb9cc6aa0790205121e47ec8ae8091a0247a4566ca0a",
		"hooks.json": "e411748245fd87be9f0f88dea7f987352827900acb615d8ff8271db018605727",
		"hooks/README.md": "9ca1d291ae7fb0f79e60bb3982f3ff4dba488844f4fa833088b710e6b2616e96",
		"hooks/antigravity-contract.schema.json": "b18072ace48ca61e3182fcddfe956240db202bf104ee18bf03800ab9a87b3144",
		"hooks/antigravity-doctor.mjs": "64d70ac198283b1d1cc5198fccbce181425eb67062776a0d85b1af827e0a797a",
		"hooks/antigravity-hooks.schema.json": "a9857d66a28062177a8bb381d7893674b385aac5b9965529283c18e0e890d62f",
		"hooks/build-plugin.mjs": "1fd229c7441aa2fddcdb9434bb8ada76b6012456c98fa0b8db2bff2a01dfbab4",
		"hooks/plugin/GEMINI.md": "519f5d78c2c4ef4fe8f24eb6a294f603ac6498302633315f6c2b2e2095a64d90",
		"hooks/plugin/gemini-extension.template.json": "cf6e333575fa642ff2b7715edeb5a46d2c8ee0a08b761fadc123e7bb5c13192c",
		"hooks/sync-mcp.mjs": "b56963054f34cf56b63ef9bc0e4c7cedd88a49b808c682a5341e61b8ec5db05f",
		"hooks/tests/antigravity.test.mjs": "5e40131265749f54347470a6462dbfdf51ccef0a69165baf008b0b87443dbd5a",
		"hooks/validate-tool-call.mjs": "c8f0be06e8697efbfe3a2e614a3bed1a6e12c714e3faef72ca31c5fbe168e857",
		"mcp_config.json": "cb41a099a03068860be9da7cc94c8eb9914f84d487cd8f8c1fffd7d021ff7688",
		"memory/MEMORY.md": "b553a654b8a59d7dcc102d4e38e77474e060c6a718cfed1ffe09528caa7abcfa",
		"memory/feedback-history.md": "06abb008293a359ebf30eafaacc0212c4a21e659170f251edd354f5433bfb1a5",
		"memory/project-conventions.md": "a121234b78e7d0c33908796e71eabde58c12e6becc36a4d3175f1b5b3a03c803",
		"memory/tech-decisions.md": "001f735f5fbc665c2bfedf3f637336cf3a25b4af7dcccd11739c8aff232e872c",
		"memory/user-preferences.md": "251ac5dea279b0bb18a5107ef599ef718837f5f60317c7728c370e83d74d5d37",
		"rules/code-rules.md": "3e602c516f195ddeb6fb986aa8cead49a0ebae8a48720f738d4642146dd510a5",
		"rules/core-protocol.md": "647becf363128a82e65ed9628f9ab82b0142692825b7f94f0e264ad6d1cacba2",
		"rules/design-rules.md": "73ee8f120e85939d04a7153bd7d2336cfb7d3025c9c6fc4b9003eca97e3f228b",
		"rules/quick-reference.md": "f077e962ea7ad1a5afc51efca8f3d27c68b895398e0f0f153c118a9cb635593c",
		"rules/request-routing.md": "2e5e04fc7b500e77c41d3875e4cf3769c83243d78dc419e441b2944aceecbb4d",
		"rules/universal-rules.md": "8f03f437aa32909f473573c75754b671cb47344de82a18c4f8926db6a41c2388",
		"schemas/component-frontmatter.schema.json": "8fed5bf3e4b374589b48a95086d864d186424202ef011d39a698e475089fef7e",
		"schemas/manifest-lock.schema.json": "0f55921773dca0e66aa814ecb78e1414a28a907d401bc3b948755323a4213dc0",
		"schemas/manifest.schema.json": "26044d4a36b587bdc150ec99af13a413638b5c41e83967a26fde22ddeb735270",
		"schemas/memory.schema.json": "8592059e9efac4dda61a425c6dc8872aeb6d6ad24f389c16fe8cd010382bb53b",
		"scripts/README.md": "fe86574d67fb46cbb914944160575aed11bd4ef28c00e82e6689cd77f4c33c5b",
		"scripts/auto_preview.py": "1208d1f3d89472b397e580993578b75e33f64274e67904233539bcb9d6e48308",
		"scripts/checklist.py": "4f4583b494c6cccdb9f0e01bae333032e381fab9607b2b574dcbf84080864ec3",
		"scripts/component_registry.py": "fcc09d1ac49b457352d5ddc74153972fb3209bef03c3f6b4716ada82e16d5153",
		"scripts/dependency_graph.py": "2a92705a7830bbe6465c05def2fb8e1729c9ce167f02e05bc03985f76bfbfd9d",
		"scripts/generate_manifest.py": "3b4e271cbe82abfecd72419331c9bcc4e165f3f825bcea579e2c4a6ea76b6f50",
		"scripts/session_manager.py": "dcacd94cc1117f81440c158fb6073cce69ab1e7bc7ecd54684bdef7c1b405d64",
		"scripts/tests/test_toolkit.py": "9e3937b2873d2954b9820d36b085c0d18a7da9afb85b7995da7ec410bb526805",
		"scripts/validate_kit.py": "c23e2c925172c71f416eab70b0b656900a8ec4b4ad29a6d6e7b13bfd10678f72",
		"scripts/validation_runner.py": "382463ab326c1978e76b45b45943ff99c60b04392e23aa46570e46359bff8664",
		"scripts/verify_all.py": "8a8d5f45cb2d76dbd34464ce81954c8e8f8b350f1ca39d98ea305595f827c2e6",
		"skills/api-patterns/SKILL.md": "b9f16c4cb87d14f0ad9407556481e25b63312eb86602520f6533776d8ad19550",
		"skills/api-patterns/api-style.md": "4295b97c36ebf411a86ed644d733fcfb8fa198569243ea11babb2cf168833fb5",
		"skills/api-patterns/auth.md": "d35ba351bf05454ad097522b80fb19368b47f66ff4ab0e76a0d69e303c2b72f0",
		"skills/api-patterns/documentation.md": "aa1d0262be74814e7d72d5dd2a4acf074235e8ca33c0dff0ec986adfd962a124",
		"skills/api-patterns/graphql.md": "f7f49e84697c8993d9cdc66b3ada56f71b01d2221107cfe70bbf291628136b8c",
		"skills/api-patterns/rate-limiting.md": "f1538d288ce362012241a6085beb3b5ff06d11f754b5867bf0adb7b62afd0657",
		"skills/api-patterns/response.md": "37bc83dfd2c4365ea9f50e531149c22e6ecdafd9d0b66c2170528b2d88a8cfa6",
		"skills/api-patterns/rest.md": "20bbf589c4f583b482f4610f41d25669af7224e989427353f18092e11d59970f",
		"skills/api-patterns/scripts/api_validator.py": "0c633f13a560ba75556e434eb87adbd37d4c1b98ff6eb9b9ca36a2df5b192852",
		"skills/api-patterns/security-testing.md": "e5cbe598d1b44356362325d5f55ee703efdbf8908a92cbd91a9c989d1ec1f9de",
		"skills/api-patterns/trpc.md": "722dde150b45392b9517a2053e53958619cb8fc0c2047c8ef09be4bcb5e9095d",
		"skills/api-patterns/versioning.md": "58abb2fc534e687bb54a4a191188f2698ec9ed3e4e12ba269d93cc03ed8d1ee6",
		"skills/app-builder/SKILL.md": "567a69668c386e4fc314ef9dfcad9c6c43c8103e64df658c1aa03f429795675a",
		"skills/app-builder/agent-coordination.md": "320e56018112ac581a7b2e5b3d19d00f0ad4cc12396229e02daf88a659b72670",
		"skills/app-builder/feature-building.md": "7bab2efd61d7b909b9b49820bd9186c3652c506a7e2ae6686344643422acccb0",
		"skills/app-builder/project-detection.md": "6d2fd5eec4c0302df6d24632c5addfab5f66f1764ccfc188b31e17929ca7568d",
		"skills/app-builder/scaffolding.md": "9327f5512b675f8ac39252b7daba7d0b605f31d3159ec13d9f21ac2f86a8d66a",
		"skills/app-builder/tech-stack.md": "e51cc060602d7731ba33baa92c4a3d0c6a3ec79ad780e9b9831f7c749fb6cc67",
		"skills/app-builder/templates/SKILL.md": "7060d11aa7ae48f2646a472e19217b3f0aa6a38770f2cb1ffa95057aaca8f5ec",
		"skills/app-builder/templates/astro-static/TEMPLATE.md": "1582e72975fa1246fe63608b229a03d7ebb54655ca2985c9b43a596dd25c9ba8",
		"skills/app-builder/templates/chrome-extension/TEMPLATE.md": "4c12fe2c7fe5f2bd8a620d9536673f35ce52f11688c8d16b88ccb666d44f3a2b",
		"skills/app-builder/templates/cli-tool/TEMPLATE.md": "e45c9320ff42c2c98c2f22e31151539ab316d6ba980d293a5e951fec530e4a2b",
		"skills/app-builder/templates/electron-desktop/TEMPLATE.md": "882c67a9bbd8c7a3ab4ffa8567c8ce55e97fecb6deef5362baf8eabd5cbad9ba",
		"skills/app-builder/templates/express-api/TEMPLATE.md": "dbe3ad3ded523eeca1e0e1fcab5a24dfdcee5064a180ac76f18d6025d0f9a081",
		"skills/app-builder/templates/flutter-app/TEMPLATE.md": "558bb2f021ad6140e2b22cd3b163a8f09566624d5b6b590949ed961ac211f945",
		"skills/app-builder/templates/monorepo-turborepo/TEMPLATE.md": "489dcbd23d3eccf62e006387b9eccae7de3cdf9acf86e16f3bd97807c8dccd73",
		"skills/app-builder/templates/nextjs-fullstack/TEMPLATE.md": "5d20cb8507786f719927efbbf7d8e513b9258e522c918b318c81fd5605a94b07",
		"skills/app-builder/templates/nextjs-saas/TEMPLATE.md": "2bafcb6b69b241d235b71ff12e2141c331d7be45939d1007958eecd82ede8ebf",
		"skills/app-builder/templates/nextjs-static/TEMPLATE.md": "43cecc7e623f3b86b44dd92dfe5eac9e96409c946c3f5071cb40d85e0d0642ce",
		"skills/app-builder/templates/nuxt-app/TEMPLATE.md": "51502c55fc9ddc7baea76ee9606e876fed75aed71f4d314f890a011be26361ba",
		"skills/app-builder/templates/python-fastapi/TEMPLATE.md": "2be2c92e91bb3b41c09dbb63eb31028f4f36f22da06b05ec88700c1fae517cd1",
		"skills/app-builder/templates/react-native-app/TEMPLATE.md": "eafc503c3fb8f70bad0ed2cac4a3a6adc010f3ef3282c778faa55eff3c37f2eb",